decision_week,brand,finished_good_sku,total_forecast_4w,available_inventory,inbound_qty_4w,net_requirement,inventory_cover_week,recommended_order_qty,selected_action,gate_status,warning,reason_1,reason_2
61,AquaMuse,AM_BASIC_TONER,3714,8140,140,-4566,8.766828217555197,0,reduce_review,review,none,Net requirement is covered,Inventory cover is high for SKU type with overstock risk
61,AquaMuse,AM_BUNDLE_KIT,2567,2207,450,-90,3.439033891702376,0,hold_with_inbound_monitoring,pass,none,Current shortage is expected to be covered by inbound within 4 weeks,Monitor inbound execution before placing a new order
61,GlowLab,GL_HERO_SERUM,9543,11530,1900,-3887,4.832861783506235,0,hold,pass,none,Available inventory plus inbound covers 4-week forecast,No incremental replenishment required
61,GlowLab,GL_NEW_AMPOULE,3225,1376,60,1789,1.7066666666666668,2610,order_with_timing_check,review,cover_below_lead_time,Inventory cover is shorter than lead time,Order is needed and timing risk should be checked
61,PureLeaf,PL_GLOBAL_CREAM,3661,2506,3000,-1845,2.7380497131931167,0,hold_with_inbound_monitoring,pass,cover_below_lead_time,Current shortage is expected to be covered by inbound within 4 weeks,Monitor inbound execution before placing a new order
61,PureLeaf,PL_SLOW_MASK,495,944,0,-449,7.6282828282828286,0,hold,pass,none,Available inventory plus inbound covers 4-week forecast,No incremental replenishment required
